701,https://www.cbc.ca/news/canada/nova-scotia/kirk-johnson-north-preston-boxer-traffic-stop-street-checks-police-1.5331993,N.S. boxer who won discrimination case wants race-based data on traffic stops,2019-10-23,2019-10-23,0,Nova Scotia,,,Non-Criminal,,,Black/African/Caribbean,,,,,,,,,,,Harassment: Racial profiling,NC; profiled; anti-black; Nova Scotia,,,,
702,https://www.insauga.com/heres-how-mississauga-is-opposing-a-controversial-quebec-bill,Here's how Mississauga is opposing a controversial Quebec bill,2019-10-23,2019-10-23,0,Ontario,Mississauga,,Non-Criminal,,,,,,,,,,,,"Religious discrimination: Anti-Semitism, Religious discrimination: Islamophobia",Politics,,NC; political ; human rights; anti-Muslim ; anti-semitic; anti-racism; Mississauga,,,,
703,https://nationalpost.com/news/politics/election-2019/nothing-but-a-vanity-project-peoples-party-of-canada-is-likely-dead-experts-say,"Nothing but a ‘vanity project’: People’s Party of Canada is likely dead, experts say",2019-10-22,2019-10-22,0,,,,Non-Criminal,,,,,,,,,,,,Xenophobia,Politics,,NC; political; anti-immigrant ; anti-racism; National,,,,
704,https://www.mtlblog.com/news/canada/qc/montreal/montreal-stm-bus-stop-sign-vandalized-with-racist-message-photo,Someone Vandalized A Downtown STM Bus Stop Sign With A Racist Message,,2019-10-27,,Quebec,Montreal,,,,,Indigenous,,,,,,,,,,Transit,"Hate speech: Other, Vandalism",Unknown; vandalism ; hate speech; ani-indigenous; Montreal,,,,
705,https://www.cp24.com/news/syrian-restaurant-owners-filing-complaint-about-hate-messages-toronto-cops-say-1.4631602,"Syrian restaurant owners filing complaint about hate messages, Toronto cops say",2019-10-09,2019-10-09,0,Ontario,Toronto,,,,,Middle Eastern,,,,,,Syria,,,,,Hate speech: Other,Police Investigation; hate speech; anti-Syrian; Toronto,,,,
706,https://thelinknewspaper.ca/article/protest-denounces-federal-decision-to-appeal-canadian-human-rights-tribunal-ruling,Protest Denounces Federal Decision to Appeal Canadian Human Rights Tribunal Ruling,2019-10-20,2019-10-20,0,Quebec,Montreal,,Non-Criminal,,,Indigenous,,,,,,,,,,Politics,,NC; political ; human rights ; protest; anti-indigenous ; anti-racism; Montreal,,,,
707,https://themedium.ca/news/peel-region-council-officially-denounces-bill-21/,Peel Region Council officially denounces Bill 21,,2019-10-20,,Ontario,Peel Region,,Non-Criminal,,,,,,,,,,,,"Religious discrimination: Anti-Semitism, Religious discrimination: Islamophobia",Politics,,NC; political ; human rights; anti-Muslim ; anti-semitic; anti-racism; Peel Region,,,,
708,https://www.cbc.ca/news/canada/edmonton/edmonton-city-council-quebec-bill-21-1.5325405,Edmonton city councillors denounce Quebec's Bill 21,2019-10-17,2019-10-17,0,Alberta,Edmonton,,Non-Criminal,,,,,,,,,,,,"Religious discrimination: Anti-Semitism, Religious discrimination: Islamophobia",Politics,,NC; political ; human rights; anti-Muslim ; anti-semitic; anti-racism; Edmonton,,,,
709,https://election.ctvnews.ca/truth-tracker-no-justin-trudeau-does-not-want-to-implement-sharia-law-in-canada-1.4644834,"Over the last week, several memes suggesting that one of Trudeau’s “unwritten promises” upon re-election would be to introduce Sharia law have been shared on right-wing social media accounts, garnering hundreds of shares",2019-10-18,2019-10-18,0,,,,Non-Criminal,,,,,,,,,,,,Religious discrimination: Islamophobia,"Online: Social media, Politics",,NC; political; anti-Muslim; National,,,,
710,https://www.salon.com/2019/10/17/obama-endorses-canadas-justin-trudeau-for-another-term-in-spite-of-blackface-scandal/,Obama endorses Canada's Justin Trudeau for another term in spite of blackface,2019-10-17,2019-10-17,0,,,,Non-Criminal,,,Black/African/Caribbean,,,,,,,,,,Politics,,NC; race relations ; political; anti-black; National,,,,
711,https://www.cbc.ca/news/canada/ottawa/university-of-ottawa-racism-1.5325143,"U of O students want broad, proactive anti-racism plan",2019-10-18,2019-10-18,0,Ontario,Ottawa,,Non-Criminal,,,Black/African/Caribbean,,,,,,,,,,,Harassment: Racial profiling,NC; race relations ; profiled; anti-black ; anti-racism; Ottawa,,,,
712,https://www.cbc.ca/news/canada/london/saunders-school-muslim-reaction-sensationalized-tensions-london-ontario-1.5321286,We can't always jump to conclusions': Did the fight at Saunders fuel unnecessary racial tension?,2019-10-16,2019-10-16,0,Ontario,London,,Non-Criminal,,,"Indigenous, Middle Eastern",,,,,,,,,,,,NC; race relations; anti-racism ; anti-Indigenous ; anti-Middle Eastern; London,,,,
713,https://www.cbc.ca/news/canada/nova-scotia/battiste-liberal-apology-sydney-victoria-racist-sexist-1.5312517,"N.S. Liberal candidate looks to move past racist, sexist social media posts",2019-10-07,2019-10-07,0,Nova Scotia,,,Non-Criminal,,,"East Asian, Indigenous",,,China,,,,,,,"Online: Social media, Politics",,NC; political; anti-Indigenous ; anti-Chinese; Nova Scotia,,,,
714,https://globalnews.ca/news/6003564/ideas-hurtful-canada-singh-bernier-leaders-debates/,‘Your ideas are hurtful to Canada’: Singh tells Bernier he shouldn’t be at the leaders’ debates,2019-10-07,2019-10-07,0,,,,Non-Criminal,,,,,,,,,,,,Xenophobia,Politics,,NC; political; anti-immigrant ; anti-racism; National,,,,
715,https://www.cjnews.com/news/canada/two-men-charged-with-hate-in-burlington-ont,"TWO MEN CHARGED WITH HATE CRIMES IN BURLINGTON, ONT.",,2019-10-07,,Ontario,Burlington,,Criminal: Unknown,,,,,,,,,,,,Religious discrimination: Anti-Semitism,,Vandalism,C; hate crime ; vandalism; anti-semitic; Burlington,,,,
716,https://www.cbc.ca/news/canada/hamilton/hamilton-synagogue-beth-jacob-anti-semitic-graffiti-police-1.5311598,"Hamilton synagogue vandalized with anti-Semitic graffiti, police investigating",2019-10-07,2019-10-07,0,Ontario,Hamilton,,,,,,,,,,,,,,Religious discrimination: Anti-Semitism,,Vandalism,Police Investigation; vandalism; anti-semitic; Hamilton,,,,
717,https://globalnews.ca/video/6003529/leaders-debate-scheer-says-trudeau-uses-racism-hateful-language-to-demonize-anyone-who-disagrees-with-him,"Leaders’ Debate: Scheer says Trudeau uses racism, hateful language to ‘demonize’ anyone who disagrees with him",,2019-10-07,,,,,Non-Criminal,,,,,,,,,,,,,Politics,,NC; political ; allegations; National,,,,
718,https://www.simcoereformer.ca/news/local-news/accusations-of-racism-dog-candidate,Accusations of racism dog candidate,2019-10-08,2019-10-08,0,Ontario,Norfolk,,Non-Criminal,,,Black/African/Caribbean,,,,,,,,,,Politics,,"NC; political ; allegations; anti-black; Norfolk, ON",,,,
719,https://www.cjnews.com/news/canada/group-urges-federal-candidates-to-sign-anti-bill-21-pledge,GROUP URGES FEDERAL CANDIDATES TO SIGN ANTI-BILL 21 PLEDGE,,2019-10-07,,Ontario,Toronto,,Non-Criminal,,,,,,,,,,,,"Religious discrimination: Anti-Semitism, Religious discrimination: Islamophobia",Politics,,NC; political ; human rights; anti-Muslim ; anti-semitic; anti-racism; Toronto,,,,
721,https://globalnews.ca/news/6035104/jagmeet-singh-charlie-angus-defamation/,"NDP’s Singh, Angus hit with defamation claim over N.B. defection remarks; party pushes back",2019-10-15,2019-10-15,0,,,,Non-Criminal,,,South Asian,,,,,,,India,,Religious discrimination: Anti-Sikhism,Politics,,NC; political ; allegations; anti-Sikh/Indian; National,,,,
722,https://www.huffingtonpost.ca/entry/green-party-quebec-islamophobic_ca_5da64d95e4b002e33e7698cf,Green party learned of Islamophobic social-media posts by four of its Quebec candidates,,2019-10-15,,,,,Non-Criminal,,,,,,,,,,,,Religious discrimination: Islamophobia,"Online: Social media, Politics",,NC; political; anti-Muslim; National,,,,
723,https://www.thechronicleherald.ca/federal-election/peoples-party-of-canada-candidate-shouldnt-have-been-included-ndp-mla-364282/,People's Party of Canada candidate shouldn't have been included: NDP MLA,,2019-10-16,,Nova Scotia,Dartmouth,,Non-Criminal,,,,,,,,,,,,Religious discrimination: Islamophobia,Politics,,NC; political; anti-racism ; anti-Muslim; Dartmouth,,,,
724,https://www.theglobeandmail.com/canada/article-former-ceo-of-dying-with-dignity-canada-accuses-organization-of/,Former CEO of Dying with Dignity Canada accuses organization of systemic discrimination in lawsuit,2019-10-15,2019-10-15,0,Ontario,Toronto,,,,,Black/African/Caribbean,,,,,,,,,,,,HR investigation; discrimination at work ; allegations; anti-black; Toronto,,,,
725,https://www.cbc.ca/news/politics/jagmeet-singh-racist-canada-1.5316318,Is Canada racist? Jagmeet Singh says 'no question' - then pulls his punches,2019-10-13,2019-10-13,0,,,,Non-Criminal,,,,,,,,,,,,,Politics,,NC; political; anti-racism; National,,,,
726,https://www.cbc.ca/news/canada/toronto/queens-university-chown-note-1.5318580,We'll make you bleed': Queen's University investigating racist and homophobic note posted inside dorm,2019-10-11,2019-10-11,0,Ontario,Toronto,Queen's University,,,,Indigenous,,,,,,,,,Anti-2SLGBTQIA+,Educational institute: Post-secondary,Hate speech: Other,Police Investigation; hate speech; anti-indigenous ; homophobia; Toronto,,,,
727,https://globalnews.ca/news/6025100/maxime-bernier-ns-ppc-islamophobia/,Maxime Bernier says N.S. PPC candidate’s tweets were racist but she won’t face consequences,2019-10-12,2019-10-12,0,Nova Scotia,,,Non-Criminal,,,,,,,,,,,,Religious discrimination: Islamophobia,Politics,Hate speech: Other,NC; political ; hate speech; anti-Muslim; Nova Scotia,,,,
728,https://www.inbrampton.com/caught-on-video-brampton-election-sign-defaced-with-racist-remarks,Brampton Election Sign Defaced with Racist Remarks,2019-10-11,2019-10-11,0,Ontario,Brampton,,,,,"Black/African/Caribbean, South Asian",,,,,,,,,,Politics,Vandalism,Unknown; political ; vandalism; anti-black ; anti-South Asian; Brampton,,,,
729,https://www.huffingtonpost.ca/entry/andrew-scheer-free-speech-conservative-platform_ca_5da10705e4b087efdbae5cb8,"Canadian post-secondary institutions that bar racist, anti-LGBTQ or other speakers from their campuses could see their research grants slashed under a Conservative government",,2019-10-11,,,,,Non-Criminal,,,,,,,,,,,,Anti-2SLGBTQIA+,Politics,,NC; political; anti-POC ; LGBTQ2S+; National,,,,
730,https://www.cbc.ca/news/canada/north/quebec-indigenous-leaders-canada-1.5318934,Quebec Indigenous leaders question gov't commitment to Indigenous issues,2019-10-11,2019-10-11,0,Quebec,,,Non-Criminal,,,Indigenous,,,,,,,,,,Politics,,NC; political ; human rights; anti-indigenous; Quebec,,,,
731,https://www.cbc.ca/news/canada/hamilton/hate-graffiti-synagogue-1.5316631,2 men arrested after investigation into hate graffiti at Hamilton synagogue,2019-10-10,2019-10-10,0,Ontario,Hamilton,,,,,,,,,,,,,,Religious discrimination: Anti-Semitism,,Vandalism,Police Investigation; vandalism; anti-semitic; Hamilton,,,,
732,https://www.cbc.ca/news/politics/elizabeth-may-green-party-racism-1.5318023,"Canada is 'awash in systemic racism,' says Green Leader Elizabeth May",2019-10-11,2019-10-11,0,,,,Non-Criminal,,,,,,,,,,,,,Politics,,NC; political; anti-racism; National,,,,
733,https://www.cbc.ca/news/canada/london/parent-indigenous-education-racial-tension-saunders-secondary-school-1.5313601,Indigenous students back to class with Saunders listening following racial tensions,2019-10-09,2019-10-09,0,Ontario,London,,Non-Criminal,,,Indigenous,,,,,,,,,,,,NC; discrimination at work; anti-indigenous; London,,,,
734,https://www.saltwire.com/news/town-of-truro-takes-historic-steps-361910/?location=newfoundland-labrador,"Issues of racism, ANS community to be addressed by Truro committee",,2019-10-09,,Nova Scotia,Truro,,Non-Criminal,,,,,,,,,,,,,Politics,,"NC; political ; race relations; anti-racism; Truro, N.S.",,,,
735,https://www.cbc.ca/news/canada/newfoundland-labrador/innu-nation-court-filing-nunatukavut-mou-1.5313083,"The president of the NCC said Innu Nation's comments about his people, their culture and their identities are racist",2019-10-08,2019-10-08,0,Newfoundland and Labrador,Labrador,,Non-Criminal,,,Indigenous,,,,,,,,,,Politics,,"NC; political ; allegations; anti-indigenous; Labrador, NL",,,,
736,https://www.stcatharinesstandard.ca/news-story/9639128-he-says-he-works-security-for-maxime-bernier-he-s-also-listed-as-a-founding-member-of-a-party-promoting-white-nationalism/,He says he works security for Maxime Bernier. He’s also listed as a founding member of a party promoting white nationalism,,2019-10-10,,,,,Non-Criminal,,,,,,,,,,,,,Politics,,NC; political; white-supremacist; National,,,,
737,https://www.thespec.com/news/hamilton-region/2019/10/10/hamilton-pro-diversity-advocate-receives-threatening-emails-for-bernier-protest-remarks.html,Hamilton pro-diversity advocate receives threatening emails for Bernier protest remarks,,2019-10-10,,Ontario,Hamilton,,,,,Black/African/Caribbean,,,,,,,,,,,"Harassment: Other, Hate speech: Other",Police Investigation; harassment ; hate speech; anti-black; Hamilton,,,,
738,https://chatnewstoday.ca/2019/10/10/singhs-stance-on-bill-21-called-out-by-anti-hate-group/,Singh’s stance on Bill 21 called out by anti-hate group,,2019-10-10,,,,,Non-Criminal,,,,,,,,,,,,Religious discrimination: Islamophobia,Politics,,NC; political; anti-racism ; anti-Muslim; National,,,,
739,https://vancouversun.com/pmn/news-pmn/canada-news-pmn/southern-alberta-man-accused-of-promoting-hatred-pleads-not-guilty/wcm/cec750c5-c5c3-4507-a306-7dc83a940c63/,Southern Alberta man accused of promoting hatred pleads not guilty,2019-10-09,2019-10-09,0,Alberta,Medicine Hat,,,,,,,,,,,,,,Religious discrimination: Anti-Semitism,,,Police Investigation; hate crime; anti-semitic; Medicine Hat,,,,
740,https://www.winnipegfreepress.com/special/federal-election/son-of-asian-immigrants-ends-candidacy-for-racist-intolerant-party-562561712.html,"Winnipeg North PPC candidate ends run for 'racist, intolerant' party",,2019-10-08,,Manitoba,Winnipeg,,Non-Criminal,,,,,,,,,,,,Anti-2SLGBTQIA+,Politics,,NC; political; anti-POC ; LGBTQ2S+; Winnipeg,,,,
741,https://bc.ctvnews.ca/racial-profiling-behind-violent-arrest-at-vancouver-walmart-indigenous-mom-1.4997247,Racial profiling behind violent arrest at Vancouver Walmart: Indigenous mom,,2019-05-12,,British Columbia,Vancouver,,,,,Indigenous,,,,,,,,,,,Harassment: Racial profiling,HR investigation; profiled; anti-indigenous; Vancouver,,,,
742,https://calgary.ctvnews.ca/alberta-energy-minister-fires-back-at-un-committee-for-criticism-of-energy-megaprojects-1.4757071,Alberta energy minister fires back at UN committee to end racism for criticism of energy megaprojects,2020-01-07,2020-01-07,0,Alberta,,,Non-Criminal,,,Indigenous,,,,,,,,,,Politics,,NC; human rights ; political; anti-indigenous; Alberta,,,,
743,https://www.cbc.ca/news/canada/british-columbia/b-c-human-rights-commissioner-calls-on-canada-to-stop-eviction-of-wet-suwet-en-people-in-pipeline-standoff-1.5423639,B.C. human rights commissioner calls on Canada to stop eviction of Wet'suwet'en people in pipeline standoff,2020-01-10,2020-01-10,0,British Columbia,,,Non-Criminal,,,Indigenous,,,,,,,,,,Politics,,NC; human rights ; protest ; political; anti-indigenous; British Columbia,,,,
744,https://bc.ctvnews.ca/investigation-ordered-into-arrest-of-indigenous-man-and-granddaughter-at-bmo-bank-1.4767247,Vancouver police chief defends handcuffing of Indigenous man and granddaughter,2020-01-14,2020-01-10,4,British Columbia,Vancouver,,,,,Indigenous,,,,,,,,,,,Harassment: Racial profiling,Police Investigation; profiled ; human rights; anti-indigenous; Vancouver,,,,
745,https://www.cbc.ca/news/canada/montreal/quebec-hockey-racism-1.5417282,Mi'kmaw hockey team target of racial slurs at Quebec tournament,2020-01-07,2020-01-07,0,Quebec,Gaspé,,Non-Criminal,,,Indigenous,,,,,,,,,,Sports: Hockey,Hate speech: Other,NC; hate speech; anti-indigenous; Gaspé region,,,,
746,https://montreal.ctvnews.ca/quebec-man-38-facing-charges-of-inciting-hate-against-minorities-1.4756762,"Quebec man, 38, facing charges of inciting hate against minorities",2020-01-07,2020-01-07,0,Quebec,Granby,,Criminal: Unknown,,,,,,,,,,,,"Anti-2SLGBTQIA+, Religious discrimination: Anti-Semitism, Religious discrimination: Islamophobia",,Hate speech: Other,"C; hate speech; anti-semitic ; anti-muslim ; anti-LGBTQ2S+ ; white supremacist; Granby, QC",,,,
747,https://www.cbc.ca/news/canada/sudbury/sault-ste-marie-racism-funding-1.5422010,"Sault Ste. Marie asks feds for $33,000 to help combat racism in the city",2020-01-10,2020-01-10,0,Ontario,Sault Ste. Marie,,Non-Criminal,,,,,,,,,,,,Xenophobia,Politics,,NC; political ; race relations; anti-racism ; anti-immigrant; Sault Ste. Marie,,,,
748,https://www.thepeterboroughexaminer.com/news-story/9804485-police-investigating-after-more-white-nationalist-posters-go-up-in-downtown-peterborough/,Police investigating after more white nationalist posters go up in downtown Peterborough,,2020-01-10,,Ontario,Peterborough,,,,,,,,,,,,,,,Politics,,Police Investigation; political; white supremacist; Peterborough,,,,
749,https://www.hilltimes.com/2020/01/07/muslim-canadian-group-deeply-disappointed-by-end-to-ethics-review-of-senator-boisvenus-facebook-activity/229643,Muslim-Canadian group ‘deeply disappointed’ by end to ethics review of Senator Boisvenu’s Facebook activity,,2020-01-07,,,,,,,,,,,,,,,,,,"Online: Social media, Politics",,HR investigation; political; white supremacist; National,,,,
750,https://www.cbc.ca/news/canada/manitoba/poems-removed-parliamentary-website-1.5416642,Poems by man who killed Indigenous woman removed from parliamentary website,2020-01-06,2020-01-06,0,,,,Non-Criminal,,,Indigenous,,,,,,,,,,"Online: Other, Politics",,NC; political; anti-indigenous; National,,,,
751,https://regina.ctvnews.ca/court-of-appeal-orders-new-trial-in-case-of-doctor-unfairly-assessed-for-coroner-s-office-job-1.4762581,Court of Appeal orders new trial in case of doctor unfairly assessed for Coroner's Office job,2020-01-10,2020-01-10,0,Saskatchewan,Regina,,,,,,,,,,,,,,,,,HR investigation; discrimination at work; not specified; Regina,,,,
752,https://globalnews.ca/news/6385839/athabasca-alberta-cab-swastika-vandalism/,"After taxi was spray-painted with swastikas, northern Alberta community rallied to help owner",2020-01-08,2020-01-08,0,Alberta,Athabasca,,,,,,,,,,,,,,Religious discrimination: Anti-Semitism,,Vandalism,Police Investigation; vandalism; anti-semitic; Athabasca,,,,
753,https://www.thepeterboroughexaminer.com/news-story/9812633-racist-graffiti-removed-from-footbridge-in-peterborough/,Racist graffiti removed from footbridge in Peterborough,,2020-01-17,,Ontario,Peterborough,,,,,Black/African/Caribbean,,,,,,,,,,,Vandalism,Police Investigation; vandalism; anti-black; Peterborough,,,,
754,https://www.thetelegram.com/news/canada/woman-accuses-halifax-police-of-racial-profiling-after-violent-walmart-arrest-399171/,Woman accuses Halifax police of racial profiling after violent Walmart arrest,,2020-01-17,,Nova Scotia,Halifax,,,,,Black/African/Caribbean,,,,,,,,,,,Harassment: Racial profiling,Police Investigation; profiled; anti-black; Halifax,,,,
755,https://nationalpost.com/pmn/news-pmn/canada-news-pmn/jewish-group-raises-concerns-about-secret-hitler-board-game-sold-in-montreal,Jewish group raises concerns about 'Secret Hitler' board game sold in Montreal,2020-01-14,2020-01-14,0,Quebec,Montreal,,Non-Criminal,,,,,,,,,,,,Religious discrimination: Anti-Semitism,,,NC; race relations; anti-semitic; Montreal,,,,
756,https://www.toronto.com/news-story/9805830--how-sad-it-was-toronto-hockey-great-s-daughter-says-of-racist-incident/,"Toronto hockey great's granddaughter victim of racist incident, accused banned from league",,2020-01-15,,Ontario,Scarborough,,Non-Criminal,,,Black/African/Caribbean,,,,,,,,,,Sports: Hockey,Hate speech: Other,NC; hate speech; anti-black; Scarborough,,,,
757,https://globalnews.ca/news/6421263/i-am-here-canada-counter-speak-facebook-comments/,Counter-speaking group trying to make social media a better place,2020-01-17,2020-01-17,0,,,,Non-Criminal,,,,,,,,,,,,,Online: Social media,,NC; race relations; anti-racism; National,,,,
758,https://www.thegrowthop.com/cannabis-business/cannabis-brand-blk-mkt-attracts-controversy-at-vancouver-conference,Cannabis brand BLK MKT attracts controversy at Vancouver conference,2020-01-17,2020-01-17,0,British Columbia,Vancouver,,Non-Criminal,,,Black/African/Caribbean,,,,,,,,,,,,NC; race relations; anti-black; Vancouver,,,,
759,https://www.thestar.com/politics/provincial/2020/01/24/ford-defends-phenomenal-appointment-of-toronto-police-officer-to-human-rights-commission.html,"Ford defends ‘phenomenal’ appointment of Toronto police officer to Human Rights Commission, during the Commission's investigation into racial profiling by Toronto Police",,2020-01-24,,Ontario,Toronto,,Non-Criminal,,,Black/African/Caribbean,,,,,,,,,,Politics,Harassment: Racial profiling,NC; political ; profiled; anti-black; Toronto,,,,
760,https://www.cbc.ca/news/canada/british-columbia/land-covenants-1.5442686,West Vancouver makes racist land covenants history,2020-01-28,2020-01-28,0,British Columbia,West Vancouver,,Non-Criminal,,,,,,,,,,,,,Politics,,NC; political; anti-racism; West Vancouver,,,,
761,https://www.cbc.ca/news/politics/csis-muslim-discrimination-lawsuit-1.5433654,"A 'second class' spy: Muslim CSIS agent alleges discrimination, abuse",2020-01-21,2020-01-21,0,Ontario,Ottawa,,,,,,,,,,,,,,Religious discrimination: Islamophobia,,Harassment: Other,HR investigation; allegations ; harassment ; hate crime; anti-muslim; Ottawa,,,,
762,https://globalnews.ca/news/6453123/halifax-police-officer-racially-profiled/,Former officer says he was racially profiled by Halifax police,2020-01-23,2020-01-23,0,Nova Scotia,Halifax,,Non-Criminal,,,Black/African/Caribbean,,,,,,,,,,,Harassment: Racial profiling,NC; profiled; anti-black; Halifax,,,,
763,https://www.cbc.ca/news/canada/toronto/coronavirus-chinese-stigma-york-regional-school-board-1.5443128,Ontario school board concerned parents' petition prompted by coronavirus fears could stoke racism,2020-01-28,2020-01-28,0,Ontario,Toronto,York,Non-Criminal,,,,,,,,,,,,,Educational institute: Other,Harassment: Racial profiling,NC; profiled; anti-asian; York,,,,
764,https://www.blogto.com/city/2020/01/coronavirus-concerns-toronto-are-leading-racism-against-chinese-community/,Racist trolls comment on blogTO's Instagram post about a new Chinese restaurant,2020-01-27,2020-01-27,0,Ontario,Toronto,,Non-Criminal,,,East Asian,,,China,,,,,,,,Harassment: Racial profiling,NC; profiled; anti-Chinese; Toronto,,,,
765,https://ottawa.ctvnews.ca/ottawa-area-school-board-investigates-racist-promposal-that-refers-to-black-people-picking-cotton-1.4792566,Ottawa-area school board investigates racist 'promposal' that refers to black people picking cotton,2020-01-31,2020-01-31,0,Ontario,Kemptville,,,,,Black/African/Caribbean,,,,,,,,,,Educational institute: Other,Hate speech: Other,"HR investigation; hate speech; anti-black; Kemptville, ON",,,,
766,https://www.cp24.com/news/anti-semitic-and-racist-graffiti-found-outside-newmarket-elementary-school-1.4785585,Anti-Semitic and racist graffiti found outside Newmarket elementary school,2020-01-27,2020-01-27,0,Ontario,Newmarket,,,,,,,,,,,,,,Religious discrimination: Anti-Semitism,Educational institute: K-12,Vandalism,"Police Investigation; vandalism; anti-semitic; Newmarket, ON",,,,
767,https://www.yorkregion.com/news-story/9837111-wuhan-noodle-restaurant-in-markham-experiences-racism-amid-coronavirus-fear/,Wuhan Noodle restaurant in Markham experiences racism amid coronavirus fear,2020-01-31,2020-01-31,0,Ontario,Markham,,Non-Criminal,,,,,,,,,,,,,,,"NC; discrimination at work; anti-asian; Markham, ON",,,,
768,https://www.cp24.com/news/racism-probe-in-peel-school-board-has-unearthed-stories-of-marginalization-discrimination-1.4785493,"Racism probe in Peel school board has unearthed 'stories of marginalization, discrimination'",2020-01-27,2020-01-27,0,Ontario,Peel Region,,,,,Black/African/Caribbean,,,,,,,,,,Educational institute: Other,,"HR investigation; discrimination at work; anti-black; Peel District, ON",,,,
769,https://www.vancouverisawesome.com/vancouver-news/disturbing-racist-flyers-circulated-east-vancouver-2053634,Extremely disturbing': Racist flyers circulated in East Vancouver,2020-01-28,2020-01-28,0,British Columbia,Vancouver,East Vancouver,,,,,,,,,,,,,"Religious discrimination: Anti-Semitism, Religious discrimination: Islamophobia",Politics,Hate speech: Letter/flyer,Police Investigation; political; white supremacist ; anti-Muslim ; anti-semitic; East Vancouver,,,,
770,https://www.straight.com/news/1352741/indigenous-scholar-and-filmmaker-nikki-sanchez-accuses-westjet-racism,Indigenous scholar and filmmaker Nikki Sanchez accuses WestJet of racism,2020-01-27,2020-01-28,-1,British Columbia,Victoria,,,,,Indigenous,,,,,,,,,,,Harassment: Racial profiling,HR investigation; profiled; anti-indigenous; Victoria,,,,
771,https://www.straight.com/news/1354031/journalist-peter-akman-no-longer-works-ctv-after-infamous-coronavirus-tweet,Journalist Peter Akman no longer works for CTV after infamous coronavirus tweet,,2020-01-30,,Ontario,Toronto,,Non-Criminal,,,,,,,,,,,,,,Harassment: Racial profiling,NC; profiled ; discrimination at work; anti-asian; Toronto,,,,
772,https://ottawasun.com/news/local-news/police-board-approves-plan-to-hire-100-new-officers/wcm/5e097e7a-e8df-4da2-bb69-c26105e86e35,"Police board supports Sloly’s plan to hire 100 new officers — service has received 363 applications, the same number received in four months of 2019. Of these applicants, 111 were racialized individuals.",2020-01-28,2020-01-27,1,Ontario,Ottawa,,Non-Criminal,,,,,,,,,,,,,,,NC; race relations; anti-racism; Ottawa,,,,
773,https://www.martlet.ca/letter-an-open-letter-to-the-victoria-police-department/,Director of International Student Relations accuses Victoria police of racial violence,2020-01-24,2020-01-21,3,British Columbia,Victoria,,Non-Criminal,,,Indigenous,,,,,,,,,,,,NC; protest ; allegations; anti-indigenous; Victoria,,,,
