398,https://globalnews.ca/news/5240573/royal-canadian-legion-soldiers-of-odin-grande-prairie/,Royal Canadian Legion issues directive after Soldiers of Odin event held at Alberta legion,2019-05-04,2019-05-04,0,Alberta,Grande Prairie,,Non-Criminal,,,,,,,,,,,,,,Hate speech: Other,NC; hate event; white supremacists; Grande Prairie,,,,
399,https://lailasnews.com/nigerian-in-canada-asks-cries-out-over-alleged-suicidal-level-racism/,Nigerian student accuses University of Saskatchewan in Canada of racism Read more: https://www.legit.ng/1236655-nigerian-student-accuses-university-saskatchewan-canada-racism.html,2019-05-04,2019-05-04,0,Saskatchewan,Saskatoon,University of Saskatchewan,Non-Criminal,,,Black/African/Caribbean,Nigeria,,,,,,,,,Educational institute: Post-secondary,,NC; discrimination at work; anti-black; Saskatoon,,,,
400,https://www.thepeterboroughexaminer.com/news-story/9340674-peterborough-area-indigenous-women-pressure-feds-to-end-sex-discrimination-in-indian-act/,Peterborough area Indigenous women pressure feds to end sex discrimination in Indian Act,2019-05-06,2019-05-06,0,Ontario,Peterborough,,Non-Criminal,,,Indigenous,,,,,,,,,,Politics,,NC; political; anti-indigenous; Peterborough,,,,
401,https://www.theglobeandmail.com/politics/article-parents-of-kids-wrongly-flagged-by-no-fly-list-urge-senate-to-pass/,Parents of kids wrongly flagged by no-fly list urge Senate to pass legislative changes quickly,2019-05-06,2019-05-06,0,Ontario,Ottawa,,Non-Criminal,,,,,,,,,,,,Religious discrimination: Islamophobia,Politics,,NC; political; anti-muslim; Ottawa,,,,
402,https://www.theguardian.pe.ca/news/canada/montreal-neighbours-rally-around-black-family-targeted-by-racist-graffiti-308654/,Ottawa neighbours rally around black family targeted by racist graffiti,,2019-05-06,,Ontario,Ottawa,,Criminal: Unknown,,,Black/African/Caribbean,,,,,,,,,,,Vandalism,C; vandalism; anti-black; Ottawa,,,,
403,https://globalnews.ca/news/5251241/ndp-candidate-addresses-hateful-comments/,Rana Zaman says she has received comments online telling her she’s not wanted.,2019-05-07,2019-05-07,0,Nova Scotia,Dartmouth,,Non-Criminal,,,,,,,,,,,,Religious discrimination: Islamophobia,"Online: Other, Politics",,NC; political; anti-muslim; Dartmouth Cole-Harbour,,,,
404,https://ca.news.yahoo.com/toronto-school-under-fire-for-mishandling-racist-incident-180836423.html,Toronto school under fire for handling of anti-black racism,2019-05-07,2019-05-07,0,Ontario,Toronto,,Non-Criminal,,,Black/African/Caribbean,,,,,,,,,,Educational institute: Other,Hate speech: Other,NC; hate speech; anti-black; Toronto,,,,
405,https://www.cbc.ca/news/canada/montreal/bill-21-institutionalize-discrimination-hearings-day-2-1.5127979,"Quebec lawmakers told secularism bill will institutionalize discrimination, stoke Islamophobia",2019-05-08,2019-05-08,0,Quebec,,,,,,,,,,,,,,,"Religious discrimination: Anti-Semitism, Religious discrimination: Anti-Sikhism, Religious discrimination: Islamophobia, Sexism",,,Law; law; anti-muslim ; anti-sikh ; anti-semitism ; gendered; Quebec,,,,
406,https://www.straight.com/news/1238686/i-dont-want-those-african-immigrants-here-black-woman-alleges-racism-burnaby-coffee,“I don’t want those African immigrants here”: Black woman alleges racism at Burnaby coffee company,2019-05-07,2019-05-09,-2,British Columbia,Burnaby,,Non-Criminal,,,Black/African/Caribbean,,,,,,,,,,,Hate speech: Other,NC; hate speech; anti-black; Burnaby,,,,
407,https://www.chch.com/marc-lemire-tells-chch-claims-against-him-are-void-of-any-factual-basis/,city of Hamilton employee who’s the centre of an investigation over his alleged ties to Neo-Nazi,,2019-05-10,,Ontario,Hamilton,,,,,,,,,,,,,,,,Hate speech: Other,Investigation; hate speech; white supremacists; Hamilton,,,,
408,https://www.cbc.ca/news/canada/north/facebook-rejects-ulu-ads-1.5130252,"Facebook rejects ads for traditional Inuit knives, calling them 'weapons'",2019-05-10,2019-05-10,0,Northwest Territories,Yellowknife,,Non-Criminal,,,Indigenous,,,,Inuit,,,,,,Online: Social media,,NC; other; anti-indigenous; Yellowknife,,,,
409,https://www.cbc.ca/news/canada/nova-scotia/it-puts-food-on-my-table-truckers-call-for-northern-pulp-extension-1.5129816,Truckers call for Northern Pulp extension ; FN reject the expansion,2019-05-09,2019-05-10,-1,Nova Scotia,Truro,,Non-Criminal,,,Indigenous,,,,,,,,,,Environmental racism,,NC; environmental racism; anti-indigenous; Truro,,,,
410,https://www.cbc.ca/news/canada/toronto/york-school-board-lawsuit-1.5134169,They didn't help me at all': Family files $1M lawsuit against York school board over racist bullying,2019-05-14,2019-05-13,1,Ontario,Toronto,York,,,,Black/African/Caribbean,,,,,,,,,,Educational institute: Other,Hate speech: Other,Lawsuit; hate speech; anti-black; York,,,,
411,https://o.canada.com/pmn/news-pmn/canada-news-pmn/mounties-in-saskatchewan-investigating-video-of-nazi-flag-burning/wcm/4347494d-21bc-44c5-b486-42a8b4da1121,Mounties in Saskatchewan investigating video of Nazi flag-burning,2019-05-13,2019-05-13,0,Saskatchewan,,,,,,,,,,,,,,,,,Vandalism,Investigation; vandalism; anti-racism; Saskatchewan,,,,
412,https://www.cbc.ca/news/canada/toronto/kevin-johnston-paramount-2-5-million-mohamad-fakih-1.5134227,"Kevin Johnston ordered to pay $2.5M for 'hateful, Islamophobic' remarks against restaurant chain owner",2019-05-13,2019-05-13,0,Ontario,Mississauga,,,,,,,,,,,,,,Religious discrimination: Islamophobia,,Hate speech: Other,Lawsuit; hate speech; anti-muslim; Mississauga,,,,
413,https://www.cbc.ca/news/politics/goodale-report-public-safety-language-1.5134678,Language matters': Goodale defends changed wording in terror report,2019-05-13,2019-05-13,0,Ontario,Ottawa,,Non-Criminal,,,,,,,,,,,,"Religious discrimination: Anti-Sikhism, Religious discrimination: Islamophobia",Politics,,NC; political; anti-sikh ; anti-muslim; Ottawa,,,,
414,https://www.cbc.ca/news/canada/edmonton/leaders-react-antisemitic-vandalism-edson-1.5133332,"Community, religious leaders react to anti-Semitic vandalism in Edson, Alta.",2019-05-13,2019-05-13,0,Alberta,Edson,,Criminal: Unknown,,,,,,,,,,,,Religious discrimination: Anti-Semitism,,Vandalism,C; vandalism; anti-semitism; Edson,,,,
415,https://www.cbc.ca/news/canada/ottawa/race-was-a-factor-in-u-of-o-carding-incident-report-finds-1.5575998?fbclid=IwAR3-D_KjiF16NAXFGJhShxS7aVRloMvrO4wfLtSrxfhI05rgga5raSQQgCc,Race was a factor in uOttawa carding incident,,2019-05-14,,Ontario,Ottawa,,,,,Black/African/Caribbean,,,,,,,,,,,,Investigation; human rights; anti-black; Ottawa,,,,
416,https://www.cbc.ca/news/canada/montreal/woman-niqab-chases-attacker-1.5136373,Montreal police investigate after woman wearing niqab attacked in public,2019-05-15,2019-05-15,0,Quebec,Montreal,,,,,,,,,,,,,,Religious discrimination: Islamophobia,,Harassment: Other,Investigation; harrassment; anti-muslim; Montreal,,,,
417,https://www.nationalobserver.com/2019/05/16/news/how-canadas-far-right-are-using-gofundme-fund-their-spread-hate,How Canada's far-right are using GoFundMe to fund their spread of hate,2019-05-13,2019-05-17,-4,,,,Non-Criminal,,,,,,,,,,,,,Online: Other,,NC; other; white supremacists; National,,,,
418,https://www.cbc.ca/news/canada/montreal/it-s-not-ok-first-nations-hockey-team-fights-racism-with-unity-1.5140794,It's not OK': First Nations hockey team fights racism with unity,2019-05-17,2019-05-17,0,Quebec,Montreal,,Non-Criminal,,,,,,,,,,,,,Sports: Hockey,,NC; other; anti-racism; Montreal,,,,
419,https://calgaryherald.com/news/canada/ss-nazi-bolts-removed-from-toronto-home/wcm/755357a2-ed50-4c88-9624-c85159d6c3bb,SS Nazi bolts removed from Toronto home,2019-05-20,2019-05-21,-1,Ontario,Toronto,,Non-Criminal,,,,,,,,,,,,Religious discrimination: Anti-Semitism,,,NC; other; anti-semitism; Toronto,,,,
420,https://www.cbc.ca/news/canada/calgary/cbe-calgary-bullying-schools-1.5142536,Few details offered on CBE school bullying review as another Calgary mother calls for action,2019-05-21,2019-05-21,0,Alberta,Calgary,,Non-Criminal,,,Black/African/Caribbean,,,,,,,,,Religious discrimination: Islamophobia,Educational institute: Other,Harassment: Other,NC; harrassment; anti-black ; anti-muslim; Calgary,,,,
421,https://globalnews.ca/news/5302433/york-region-high-school-student-assault-racism/,"‘A f-ing n-word’: York Region high school student says she was beaten, called racial slurs",2019-05-22,2019-05-22,0,Quebec,Sutton,,Criminal: Unknown,,,Black/African/Caribbean,,,,,,,,,,Educational institute: K-12,Hate speech: Other,C; hate speech; anti-black; Sutton,,,,
422,https://www.tricitynews.com/news/racist-comments-over-walmart-pa-upset-customers-in-coquitlam-1.23833302,Racist comments over Walmart PA upset customers in Coquitlam,2019-05-24,2019-05-24,0,British Columbia,Coquitlam,,Non-Criminal,,,Black/African/Caribbean,,,,,,,,,,,Hate speech: Other,NC; hate speech; anti-black; Coquitlam,,,,
423,https://www.huffingtonpost.ca/entry/raptors-superfan-nav-bhatia-racist-tweet_ca_5ce99b87e4b00356fc227179,Raptors Superfan Nav Bhatia Targeted With Racist Tweet.,,2019-05-25,,Ontario,Toronto,,Non-Criminal,,,,,,,,,,,,Religious discrimination: Anti-Sikhism,,Hate speech: Other,NC; hate speech; anti-sikh; Toronto,,,,
424,https://www.huffingtonpost.ca/entry/quebec-city-mosque-alleged-assault_ca_5ceb024ae4b0512156f3d52b,Police Probe Hate-Motivated Incident At Quebec City Mosque,,2019-05-26,,Quebec,,,,,,,,,,,,,,,"Religious discrimination: Islamophobia, Xenophobia",,Hate speech: Other,Investigation; hate speech; anti-muslim ; anti-immigration; Quebec,,,,
425,https://www.theglobeandmail.com/canada/article-thunder-bay-police-board-in-turmoil-following-removal-of-lawyer-calls/,"Thunder Bay police board in turmoil following removal of lawyer, calls for mayor’s resignation from body",2019-05-28,2019-05-28,0,Ontario,Thunder Bay,,Non-Criminal,,,,,,,,,,,,,,,NC; other; other; Thunderbay,,,,
426,https://www.cbc.ca/news/canada/ottawa/ottawa-police-hate-graffiti-1.5152132,Ottawa police investigate 3 hate graffiti incidents,2019-05-28,2019-05-28,0,Ontario,Ottawa,,Criminal: Unknown,,,Black/African/Caribbean,,,,,,,,,,,Vandalism,C; vandalism; anti-black; Ottawa,,,,
427,https://globalnews.ca/news/5331439/canadian-historical-association-unb/,professor at the University of New Brunswick accused of being a white nationalist is coming under more criticism.,2019-05-29,2019-05-29,0,New Brunswick,Fredericton,University of New Brunswick,Non-Criminal,,,,,,,,,,,,,Educational institute: Post-secondary,Hate speech: Other,NC; hate speech; white supremacists; Fredricton,,,,
428,https://www.cbc.ca/news/canada/ottawa/louis-riel-hate-graffiti-1.5152789,Ottawa high school latest target of anti-black graffiti,2019-05-28,2019-05-29,-1,Ontario,Ottawa,,Criminal: Unknown,,,Black/African/Caribbean,,,,,,,,,,Educational institute: K-12,Vandalism,C; vandalism; anti-black; Ottawa,,,,
429,https://www.nationalobserver.com/2019/05/30/news/local-ontario-councillor-sued-after-calling-out-conservative-silence-white,He called out Conservatives' silence on white supremacists. Then he got sued.,2019-03-15,2019-05-30,-76,Ontario,,,,,,,,,,,,,,,,,Hate speech: Other,Lawsuit; hate speech; white supremacists; Ontario,,,,
430,https://www.reuters.com/article/us-canada-aboriginal/canadian-inquiry-calls-deaths-of-indigenous-women-genocide-idUSKCN1T41XF,Canadian inquiry calls deaths of indigenous women 'genocide',2019-06-03,2019-06-02,1,Ontario,Ottawa,,Non-Criminal,,,Indigenous,,,,,,,,,Sexism,Politics,,NC; political; anti-indigenous ; gendered; Ottawa,,,,
431,https://www.thepostmillennial.com/mad-max-team-scrambles-to-douse-dumpster-fire-ignited-by-racist-emails/,Maxime Bernier’s PPC scrambles to douse dumpster fire ignited by racist emails,2019-05-31,2019-06-02,-2,Ontario,Ottawa,,Non-Criminal,,,,,,,,,,,,Xenophobia,Politics,,NC; political; anti-immigration; Ottawa,,,,
432,https://www.nationalobserver.com/2019/06/03/news/exclusive-canadian-facebook-page-weaponized-islamophobia-behind-facade-news,Canadian Facebook page weaponized Islamophobia behind facade of 'news',,2019-06-03,,,,,Non-Criminal,,,,,,,,,,,,Religious discrimination: Islamophobia,Online: Social media,Hate speech: Other,NC; hate speech; anti-muslim; National,,,,
433,https://dailyhive.com/vancouver/coquitlam-delivery-business-called-out-for-using-lynching-imagery-website,"Coquitlam delivery company condemned for use of KKK, 'lynching' photo on website",2019-06-04,2019-06-04,0,British Columbia,Coquitlam,,,,,Black/African/Caribbean,,,,,,,,,,Online: Other,Hate speech: Other,Investigation; hate speech; white supremacists ; anti-black; Coquitlam,,,,
434,https://o.canada.com/pmn/news-pmn/canada-news-pmn/police-investigating-series-of-suspected-hate-crimes-in-burlington/wcm/27d76680-5514-4398-b049-2987fd3e8252,Police investigating series of suspected hate crimes in Burlington,2019-06-05,2019-06-05,0,Ontario,Burlington,,Criminal: Unknown,,,,,,,,,,,,Religious discrimination: Anti-Semitism,,Vandalism,C; vandalism; anti-semetic; Burlington,,,,
435,https://dailyhive.com/vancouver/black-student-racial-profiling-ubc-academic-conference,Black student alleges racial profiling at UBC academic conference,,2019-06-05,,British Columbia,Vancouver,,Non-Criminal,,,Black/African/Caribbean,,,,,,,,,,,Harassment: Racial profiling,NC; profiled; anti-black; Vancouver,,,,
436,https://montreal.citynews.ca/2019/06/06/canadian-premier-league-investigating-use-of-racial-slurs-following-cavalry-fc-game/,Cavalry FC players allege being victims of racist remarks in Hamilton,2019-06-06,2019-06-06,0,Ontario,Hamilton,,Non-Criminal,,,Black/African/Caribbean,,,,,,,,,,,Hate speech: Other,NC; hate speech; anti-black; Hamilton,,,,
437,https://www.cbc.ca/news/canada/hamilton/people-s-party-bernier-burlington-tweet-racism-1.5163501,People's Party of Canada slammed for racist tweet from Burlington account,2019-06-05,2019-06-06,-1,Ontario,Burlington,,Non-Criminal,,,,,,,,,,,,,Politics,Hate speech: Other,NC; hate speech ; political; other; Burlington,,,,
438,https://vancouversun.com/news/national/b-c-wing-of-peoples-party-targeted-by-forged-emails-apparently-designed-to-discredit-it,Emails that appeared to come from the B.C. chapter of Maxime Bernier’s People’s Party of Canada were recently provided to the media. They purported to show a top party organizer promoting racism.,2019-06-07,2019-06-07,0,British Columbia,Vancouver,,,,,,,,,,,,,,,Politics,,Investigation; political; other; Vancouver,,,,
439,https://globalnews.ca/news/5368606/david-argyle-toronto-wolfpack-ceo-resigns/,"Toronto Wolfpack CEO, chairman resigns after racism scandal",2019-06-07,2019-06-07,0,Ontario,Toronto,,Non-Criminal,,,Black/African/Caribbean,,,,,,,,,,,Hate speech: Other,NC; hate speech; anti-black; Toronto,,,,
440,https://www.cbc.ca/news/canada/montreal/bill-21-sit-in-protest-quebec-city-secularism-1.5170846,Protesters in Quebec City say Bill 21 will 'create barriers for future generations',2019-06-11,2019-06-11,0,Quebec,Quebec City,,Non-Criminal,,,,,,,,,,,,"Religious discrimination: Anti-Semitism, Religious discrimination: Anti-Sikhism, Religious discrimination: Islamophobia",,,NC; policy; anti-muslilm ; anti-sikh ; anti-semetic; Quebec City,,,,
441,https://globalnews.ca/news/5383187/police-islamophobic-graffiti-london-muslim-mosque/,Police investigating Islamophobic graffiti outside London Muslim Mosque,2019-06-12,2019-06-12,0,Ontario,London,London Muslim Mosque,,,,,,,,,,,,,Religious discrimination: Islamophobia,,Vandalism,Investigation; vandalism; anti-muslim; London,,,,
442,https://www.cbc.ca/news/canada/hamilton/pride-hamilton-protest-1.5178037,Police took 'far too long' to respond to 'violent' Pride protest: Pride Hamilton,2019-06-17,2019-06-17,0,Ontario,Hamilton,,Criminal: Unknown,,,,,,,,,,,,"Anti-2SLGBTQIA+, Religious discrimination: Islamophobia",,,C; protest; anti-muslim ; homophobic; Hamilton,,,,
443,https://www.employmentlawtoday.com/article/40426-alberta-human-rights-tribunal-renders-landmark-costs-award-against-complainant/?utm_source=Mondaq&utm_medium=syndication&utm_campaign=View-Original,Alberta Human Rights Tribunal renders landmark costs award against complainant,2019-06-20,2019-06-20,0,Alberta,Calgary,,,,,,,,,,,,,,,,,Human Rights; discrimination at work; other; Calgary,,,,
444,https://pressprogress.ca/videos-show-far-right-hate-groups-launching-violent-attacks-inside-torontos-eaton-centre/,Videos Show Far-Right Hate Groups Launching Violent Attacks Inside Toronto’s Eaton Centre,2019-06-24,2019-06-24,0,Ontario,Toronto,Eaton Centre,Criminal: Unknown,,,,,,,,,,,,"Anti-2SLGBTQIA+, Religious discrimination: Islamophobia",,,C; protest; anti-muslim ; homophobic; Toronto,,,,
445,https://www.huffingtonpost.ca/entry/air-canada-racism-passenger_ca_5d126154e4b0a39418697e00,"Air Canada Refused To Act After 'Despicable' Racism, Says Passenger",,2019-06-26,,Ontario,Toronto,,Non-Criminal,,,,,,,,,,,,Religious discrimination: Islamophobia,,Hate speech: Other,NC; hate speech; anti-muslim; Toronto,,,,
446,https://www.rcinet.ca/en/2019/06/26/ottawa-unveils-anti-racism-initiative/,Ottawa unveils anti-racism initiative,2019-06-26,2019-06-26,0,Ontario,Ottawa,,Non-Criminal,,,,,,,,,,,,,,,NC; policy; anti-racism; Ottawa,,,,
447,https://globalnews.ca/news/5433079/air-canada-racist-incident-sonamjeet-narwan/,‘Pure incompetence’: Passenger calls out Air Canada over handling of racist incident,2019-06-26,2019-06-26,0,Ontario,Toronto,,Non-Criminal,,,,,,,,,,,,Religious discrimination: Islamophobia,,Hate speech: Other,NC; hate speech; anti-muslim; Toronto,,,,
448,https://calgary.ctvnews.ca/faith-based-groups-in-calgary-unite-in-opposition-of-quebec-s-legalized-discrimination-1.4484668,Faith-based groups in Calgary unite in opposition of Quebec's 'legalized discrimination',2019-06-26,2019-06-26,0,Quebec,,,Non-Criminal,,,,,,,,,,,,,,,NC; policy; anti-racism; Quebec,,,,
449,https://nationalpost.com/news/politics/theres-a-debate-over-canadas-new-definition-of-anti-semitism-and-it-might-sound-strangely-familiar,debate over Canada's new definition of anti-Semitism,2019-06-28,2019-06-27,1,Ontario,Ottawa,,Non-Criminal,,,,,,,,,,,,Religious discrimination: Anti-Semitism,,,NC; policy; anti-semitism; Ottawa,,,,
450,https://www.nationalobserver.com/2019/06/27/news/dont-read-darker-skinned-trudeau-image-conservatives-insist,"Don't read into darker-skinned Trudeau image, Conservatives insist",2019-06-26,2019-06-29,-3,,,,Non-Criminal,,,,,,,,,,,,,Politics,Hate speech: Imagery,NC; political; other; national,,,,
451,https://toronto.citynews.ca/2019/06/30/hate-crime-investigators-probing-alleged-assault-at-canadas-wonderland/,Hate crime investigators probing alleged assault at Canada's Wonderland,2019-06-30,2019-06-30,0,Ontario,Toronto,,Criminal: Unknown,,,,,,,,,,,,Religious discrimination: Islamophobia,,Hate speech: Other,C; hate speech; anti-muslim; Toronto,,,,
452,https://www.hilltimes.com/2019/07/03/continued-liberal-delays-to-end-sexist-indian-status-rules-baffling-to-indigenous-advocates/206156,Continued Liberal delays to end sexist Indian status rules ‘baffling’ to Indigenous advocates,,2019-07-03,,Ontario,Ottawa,,Non-Criminal,,,Indigenous,,,,,,,,,Sexism,,,NC; policy; anti-indigenous ; gendered; Ottawa,,,,
453,https://www.straight.com/news/1262216/racism-among-non-whites-black-woman-complains-against-ethnically-diverse-surrey-company,Racism among nonwhites: Black woman complains against ethnically diverse Surrey company,2019-07-03,2019-07-03,0,British Columbia,Surrey,,,,,Black/African/Caribbean,,,,,,,,,,,,Human Rights; discrimination at work; anti-black; Surrey,,,,
454,https://beta.canada.com/pmn/news-pmn/canada-news-pmn/first-nations-basketball-players-to-hit-court-despite-dispute-with-referees/wcm/c74f1ac0-1c4b-4eb2-9741-c48529fda3b6/amp/,Alberta First Nation basketball players to hit court despite referee dispute,2019-07-03,2019-07-03,0,Alberta,Calgary,,Non-Criminal,,,Indigenous,,,,,,,,,,Sports: Basketball,,NC; other; anti-indigenous; Calgary,,,,
455,https://www.cbc.ca/news/canada/british-columbia/former-b-c-jail-guard-wins-human-rights-case-for-racism-1.5202461,"The B.C. Human Rights Tribunal has concluded a former jail guard faced racism at a pre-trial centre it described as a ""poisoned work environment.""",2019-07-05,2019-07-05,0,British Columbia,Port Coquitlam,,,,,Black/African/Caribbean,,,,,,,,,,Workplace,,Human Rights; discrimination at work; anti-black; North Fraser,,,,
456,https://www.americanbazaaronline.com/2019/07/05/man-in-british-columbia-writes-racist-graffiti-outside-gurudwara-438142/,Man in British Columbia writes racist graffiti outside gurudwara,2019-10-29,2019-07-05,116,British Columbia,Williams Lake,,Criminal: Unknown,,,,,,,,,,,,Religious discrimination: Anti-Sikhism,,Vandalism,C; vandalism; anti-sikh; Williams Lake,,,,
457,https://www.cbc.ca/news/politics/rcmp-nationalist-party-1.5198409,RCMP Hate speech probe launched,2019-07-05,2019-07-05,0,Manitoba,Grand Rapids,,Criminal: Unknown,,,,,,,,,,,,Religious discrimination: Anti-Semitism,,Hate speech: Other,C; hate speech ; intellectual property; anti-semitism; Grand Rapids,,,,
458,https://www.cbc.ca/news/canada/nova-scotia/blackface-halifax-pride-black-community-facekini-photo-poster-1.5201378,Halifax Pride pulls promotional photo over blackface allegations,2019-07-07,2019-07-07,0,Nova Scotia,Halifax,,Non-Criminal,,,Black/African/Caribbean,,,,,,,,,,,Hate speech: Other,NC; hate speech; anti-black; Halifax,,,,
459,https://www.cbc.ca/news/canada/british-columbia/victoria-bc-motion-against-quebec-bill-21-religious-symbols-1.5203408,"Victoria will join Brampton, Ont., in condemning Quebec's ban of religious symbols at work",2019-07-08,2019-07-08,0,British Columbia,Victoria,,Non-Criminal,,,,,,,,,,,,"Religious discrimination: Anti-Semitism, Religious discrimination: Anti-Sikhism, Religious discrimination: Islamophobia, Sexism",Workplace,,NC; policy; anti-muslim ; anti-sikh ; anti-semitism ; gendered; Victoria,,,,
460,https://calgarysun.com/business/local-business/racist-branding-at-whyte-avenue-candy-store-removed-after-social-media-backlash/wcm/5b257957-66cb-4dbe-930b-0cd9b4ef4d16,Racist branding at Edmonton candy store removed after social media backlash,2019-07-09,2019-07-08,1,Alberta,Edmonton,,Non-Criminal,,,Black/African/Caribbean,,,,,,,,,,Online: Social media,Hate speech: Other,NC; hate speech (branding); anti-black; Edmonton,,,,
461,https://www.ourwindsor.ca/news-story/9496826-maxime-bernier-criticized-for-posing-with-members-of-northern-guard-at-calgary-stampede/,Maxime Bernier criticized for posing with members of Northern Guard at Calgary Stampede,,2019-07-10,,Alberta,Calgary,,Non-Criminal,,,,,,,,,,,,Religious discrimination: Islamophobia,Politics,,NC; political; anti-muslim ; white supremacy; Calgary,,,,
462,https://www.cbc.ca/news/canada/montreal/human-rights-complaint-over-racist-scouts-songbook-1.5206540,Montreal mom lodges racism complaint over 'unthinkable' Scouts songbook,2019-07-10,2019-07-10,0,Quebec,Montreal,,,,,Black/African/Caribbean,,,,,,,,,,,Hate speech: Other,Human Rights; hate speech; anti-black; Montreal,,,,
463,https://www.cbc.ca/news/canada/toronto/wonderland-hate-crime-investigation-york-police-1.5207327,"Alleged assault at Canada's Wonderland not 'hate-motivated,' no charges to be laid,",2019-07-10,2019-07-10,0,Ontario,Toronto,York,Criminal: Unknown,,,,,,,,,,,,Religious discrimination: Islamophobia,,,C; assualt; anti-muslim; York,,,,
464,https://www.cbc.ca/news/canada/nova-scotia/racial-discrimination-department-of-national-defence-halifax-workplace-apprentice-1.5207193,DND ordered to pay $25K for 'pure and simple racial prejudice',2019-07-14,2019-07-14,0,Nova Scotia,Halifax,,,,,Black/African/Caribbean,,,,,,,,,,,,Human Rights; discrimination at work; anti-black; Halifax,,,,
465,https://beta.canada.com/news/canada/indigenous-residents-of-ontario-island-face-discrimination-at-border-crossing-suit/wcm/d9cc3402-842f-4beb-916c-e105efb94a14/amp/,Indigenous residents forced to cross border to reach rest of Canada seek $150M for 'systemic discrimination',2019-07-17,2019-07-16,1,Ontario,Cornwall,,Non-Criminal,,,Indigenous,,,,,,,,,,,,NC; other; anti-indigenous; Cornwall,,,,
466,https://globalnews.ca/news/5511532/kamloops-hate-crime-beating/,B.C. man beaten at Kamloops nightclub claims RCMP ignored racial motives for attack,2019-07-17,2019-07-17,0,British Columbia,Kamloops,,Criminal: Unknown,,,Black/African/Caribbean,,,,,,,,,,,,C; assualt; anti-black; Kamloops,,,,
467,https://www.ctvnews.ca/canada/ontario-waterpark-criticized-over-racist-images-on-kongo-expedition-ride-1.4513331,Ontario waterpark criticized over 'racist images' on 'Kongo Expedition' ride,2019-07-18,2019-07-18,0,Ontario,Ottawa,,Non-Criminal,,,Black/African/Caribbean,,,,,,,,,,,Hate speech: Imagery,NC; other; anti-black; Ottawa,,,,
468,https://www.cbc.ca/news/canada/manitoba/people-party-canada-winnipeg-elmwood-transcona-resigns-quits-1.5215988,People's Party board in a Winnipeg riding quits over concerns about racism,2019-07-18,2019-07-18,0,Manitoba,Winnipeg,,Non-Criminal,,,,,,,,,,,,"Religious discrimination: Anti-Semitism, Xenophobia",,Hate speech: Other,NC; hate speech; anti-semitism ; anti-immigration; Winnipeg,,,,
469,https://www.cbc.ca/news/canada/nova-scotia/harbourville-bonfire-nightmare-muslim-friends-1.5220817,"Muslim friends allege violent threats, racist slurs at Annapolis Valley beach",2019-07-22,2019-07-22,0,Nova Scotia,Berwick,,,,,,,,,,,,,,Religious discrimination: Islamophobia,,Hate speech: Other,Police Investigation; hate speech; anti-muslim; Berwick,,,,
470,https://dailyhive.com/vancouver/vancouver-councillor-motion-anti-semitism-july-2019,Vancouver councillor introduces motion to better define anti-Semitism,2019-07-18,2019-07-22,-4,British Columbia,Vancouver,,Non-Criminal,,,,,,,,,,,,,,,NC; policy; anti-racism; Vancouver,,,,
